{
  "status": "normalized",
  "audience": null,
  "scenario": null,
  "duration": null,
  "language": "zh-CN",
  "tone": null,
  "aspect_ratio": "16:9",
  "page_target": 6,
  "citation_policy": "notes",
  "template": null,
  "brand": null,
  "values": {
    "scenario": null,
    "asset_policy": {
      "allow_network": false,
      "minimum_pixels": [
        1,
        1
      ]
    },
    "brand": null,
    "template": null,
    "language": "zh-CN",
    "duration": null,
    "page_count": 6,
    "audience": null,
    "minimum_font_size": 16,
    "aspect_ratio": "16:9",
    "citation_policy": "notes",
    "adaptive_policy": {},
    "tone": null,
    "output_formats": [
      "pdf",
      "png",
      "pptx"
    ]
  },
  "constraints": {
    "hard": [
      {
        "constraint_id": "candidate_02b808e2-dcaf-4fea-9ae3-5b6b0783c4d7",
        "field": "language",
        "value": "zh-CN",
        "source": {
          "kind": "user_instruction",
          "reference": "raw_text:16:18"
        }
      }
    ],
    "soft": [
      {
        "constraint_id": "candidate_14d336a2-b624-4ecb-8120-7592f8b814d6",
        "field": "page_count",
        "value": 6,
        "source": {
          "kind": "user_instruction",
          "reference": "runtime_preferences.page_count"
        },
        "disposition": "applied",
        "applied_value": 6,
        "handling_reason": "Selected by DEC-002 and within current execution subset."
      }
    ],
    "defaults": [
      {
        "constraint_id": "system_default.page_count",
        "field": "page_count",
        "value": 10,
        "source": {
          "kind": "system_default",
          "reference": "DEC-002 versioned runtime defaults"
        },
        "used": false,
        "handling_reason": "DEC-002 selects defaults only without higher precedence and within current execution support."
      },
      {
        "constraint_id": "system_default.language",
        "field": "language",
        "value": "zh-CN",
        "source": {
          "kind": "system_default",
          "reference": "DEC-002 versioned runtime defaults"
        },
        "used": false,
        "handling_reason": "DEC-002 selects defaults only without higher precedence and within current execution support."
      },
      {
        "constraint_id": "system_default.aspect_ratio",
        "field": "aspect_ratio",
        "value": "16:9",
        "source": {
          "kind": "system_default",
          "reference": "DEC-002 versioned runtime defaults"
        },
        "used": true,
        "handling_reason": "DEC-002 selects defaults only without higher precedence and within current execution support."
      },
      {
        "constraint_id": "system_default.minimum_font_size",
        "field": "minimum_font_size",
        "value": 16,
        "source": {
          "kind": "system_default",
          "reference": "DEC-002 versioned runtime defaults"
        },
        "used": true,
        "handling_reason": "DEC-002 selects defaults only without higher precedence and within current execution support."
      },
      {
        "constraint_id": "system_default.template",
        "field": "template",
        "value": null,
        "source": {
          "kind": "system_default",
          "reference": "DEC-002 versioned runtime defaults"
        },
        "used": true,
        "handling_reason": "DEC-002 selects defaults only without higher precedence and within current execution support."
      },
      {
        "constraint_id": "system_default.brand",
        "field": "brand",
        "value": null,
        "source": {
          "kind": "system_default",
          "reference": "DEC-002 versioned runtime defaults"
        },
        "used": true,
        "handling_reason": "DEC-002 selects defaults only without higher precedence and within current execution support."
      },
      {
        "constraint_id": "system_default.output_formats",
        "field": "output_formats",
        "value": [
          "pptx",
          "pdf",
          "png"
        ],
        "source": {
          "kind": "system_default",
          "reference": "DEC-002 versioned runtime defaults"
        },
        "used": false,
        "handling_reason": "DEC-002 selects defaults only without higher precedence and within current execution support."
      },
      {
        "constraint_id": "system_default.audience",
        "field": "audience",
        "value": null,
        "source": {
          "kind": "system_default",
          "reference": "DEC-002 versioned runtime defaults"
        },
        "used": true,
        "handling_reason": "DEC-002 selects defaults only without higher precedence and within current execution support."
      },
      {
        "constraint_id": "system_default.scenario",
        "field": "scenario",
        "value": null,
        "source": {
          "kind": "system_default",
          "reference": "DEC-002 versioned runtime defaults"
        },
        "used": true,
        "handling_reason": "DEC-002 selects defaults only without higher precedence and within current execution support."
      },
      {
        "constraint_id": "system_default.duration",
        "field": "duration",
        "value": null,
        "source": {
          "kind": "system_default",
          "reference": "DEC-002 versioned runtime defaults"
        },
        "used": true,
        "handling_reason": "DEC-002 selects defaults only without higher precedence and within current execution support."
      },
      {
        "constraint_id": "system_default.tone",
        "field": "tone",
        "value": null,
        "source": {
          "kind": "system_default",
          "reference": "DEC-002 versioned runtime defaults"
        },
        "used": true,
        "handling_reason": "DEC-002 selects defaults only without higher precedence and within current execution support."
      },
      {
        "constraint_id": "system_default.citation_policy",
        "field": "citation_policy",
        "value": "notes",
        "source": {
          "kind": "system_default",
          "reference": "DEC-002 versioned runtime defaults"
        },
        "used": true,
        "handling_reason": "DEC-002 selects defaults only without higher precedence and within current execution support."
      },
      {
        "constraint_id": "system_default.asset_policy",
        "field": "asset_policy",
        "value": {
          "allow_network": false,
          "minimum_pixels": [
            1,
            1
          ]
        },
        "source": {
          "kind": "system_default",
          "reference": "DEC-002 versioned runtime defaults"
        },
        "used": true,
        "handling_reason": "DEC-002 selects defaults only without higher precedence and within current execution support."
      },
      {
        "constraint_id": "system_default.adaptive_policy",
        "field": "adaptive_policy",
        "value": {},
        "source": {
          "kind": "system_default",
          "reference": "DEC-002 versioned runtime defaults"
        },
        "used": true,
        "handling_reason": "DEC-002 selects defaults only without higher precedence and within current execution support."
      }
    ],
    "conflicts": []
  },
  "issues": [],
  "warnings": [],
  "trace_id": "trace_2ea64153-16c5-4a8d-b3e4-6d77f5fe9ec8"
}