{
  "status": "normalized",
  "audience": null,
  "scenario": null,
  "duration": null,
  "language": "zh-CN",
  "tone": null,
  "aspect_ratio": "16:9",
  "page_target": 4,
  "citation_policy": "notes",
  "template": null,
  "brand": null,
  "values": {
    "language": "zh-CN",
    "audience": null,
    "aspect_ratio": "16:9",
    "template": null,
    "tone": null,
    "duration": null,
    "minimum_font_size": 16,
    "brand": null,
    "page_count": 4,
    "citation_policy": "notes",
    "scenario": null,
    "output_formats": [
      "pdf",
      "png",
      "pptx"
    ]
  },
  "constraints": {
    "hard": [
      {
        "constraint_id": "candidate_655c5850-30f7-455f-bdaf-e8c9e9e1057e",
        "field": "page_count",
        "value": 4,
        "source": {
          "kind": "user_instruction",
          "reference": "raw_text:6:8"
        }
      },
      {
        "constraint_id": "candidate_07d7f1f5-cdfa-4eed-9b1a-7c1b22f1aaef",
        "field": "language",
        "value": "zh-CN",
        "source": {
          "kind": "user_instruction",
          "reference": "raw_text:8:10"
        }
      }
    ],
    "soft": [
      {
        "constraint_id": "user-eight-pages",
        "field": "page_count",
        "value": 4,
        "source": {
          "kind": "user_instruction",
          "reference": "fixture explicit input"
        },
        "disposition": "applied",
        "applied_value": 4,
        "handling_reason": "Selected by DEC-002 and within current execution subset."
      }
    ],
    "defaults": [
      {
        "constraint_id": "system_default.page_count",
        "field": "page_count",
        "value": 10,
        "source": {
          "kind": "system_default",
          "reference": "DEC-002 versioned runtime defaults"
        },
        "used": false,
        "handling_reason": "DEC-002 selects defaults only without higher precedence and within current execution support."
      },
      {
        "constraint_id": "system_default.language",
        "field": "language",
        "value": "zh-CN",
        "source": {
          "kind": "system_default",
          "reference": "DEC-002 versioned runtime defaults"
        },
        "used": false,
        "handling_reason": "DEC-002 selects defaults only without higher precedence and within current execution support."
      },
      {
        "constraint_id": "system_default.aspect_ratio",
        "field": "aspect_ratio",
        "value": "16:9",
        "source": {
          "kind": "system_default",
          "reference": "DEC-002 versioned runtime defaults"
        },
        "used": true,
        "handling_reason": "DEC-002 selects defaults only without higher precedence and within current execution support."
      },
      {
        "constraint_id": "system_default.minimum_font_size",
        "field": "minimum_font_size",
        "value": 16,
        "source": {
          "kind": "system_default",
          "reference": "DEC-002 versioned runtime defaults"
        },
        "used": true,
        "handling_reason": "DEC-002 selects defaults only without higher precedence and within current execution support."
      },
      {
        "constraint_id": "system_default.template",
        "field": "template",
        "value": null,
        "source": {
          "kind": "system_default",
          "reference": "DEC-002 versioned runtime defaults"
        },
        "used": true,
        "handling_reason": "DEC-002 selects defaults only without higher precedence and within current execution support."
      },
      {
        "constraint_id": "system_default.brand",
        "field": "brand",
        "value": null,
        "source": {
          "kind": "system_default",
          "reference": "DEC-002 versioned runtime defaults"
        },
        "used": true,
        "handling_reason": "DEC-002 selects defaults only without higher precedence and within current execution support."
      },
      {
        "constraint_id": "system_default.output_formats",
        "field": "output_formats",
        "value": [
          "pptx",
          "pdf",
          "png"
        ],
        "source": {
          "kind": "system_default",
          "reference": "DEC-002 versioned runtime defaults"
        },
        "used": false,
        "handling_reason": "DEC-002 selects defaults only without higher precedence and within current execution support."
      },
      {
        "constraint_id": "system_default.audience",
        "field": "audience",
        "value": null,
        "source": {
          "kind": "system_default",
          "reference": "DEC-002 versioned runtime defaults"
        },
        "used": true,
        "handling_reason": "DEC-002 selects defaults only without higher precedence and within current execution support."
      },
      {
        "constraint_id": "system_default.scenario",
        "field": "scenario",
        "value": null,
        "source": {
          "kind": "system_default",
          "reference": "DEC-002 versioned runtime defaults"
        },
        "used": true,
        "handling_reason": "DEC-002 selects defaults only without higher precedence and within current execution support."
      },
      {
        "constraint_id": "system_default.duration",
        "field": "duration",
        "value": null,
        "source": {
          "kind": "system_default",
          "reference": "DEC-002 versioned runtime defaults"
        },
        "used": true,
        "handling_reason": "DEC-002 selects defaults only without higher precedence and within current execution support."
      },
      {
        "constraint_id": "system_default.tone",
        "field": "tone",
        "value": null,
        "source": {
          "kind": "system_default",
          "reference": "DEC-002 versioned runtime defaults"
        },
        "used": true,
        "handling_reason": "DEC-002 selects defaults only without higher precedence and within current execution support."
      },
      {
        "constraint_id": "system_default.citation_policy",
        "field": "citation_policy",
        "value": "notes",
        "source": {
          "kind": "system_default",
          "reference": "DEC-002 versioned runtime defaults"
        },
        "used": true,
        "handling_reason": "DEC-002 selects defaults only without higher precedence and within current execution support."
      }
    ],
    "conflicts": []
  },
  "issues": [],
  "warnings": [],
  "trace_id": "trace_19268722-4507-4fc7-b5dd-b5babfc2afe7"
}